{
    "pipeline_uuid": "10650844-1baa-55c5-a481-5e945b19c065",
    "archive_path": "/sample/tacc-cloud/agavehelpers/upload",
    "archive_patterns": [],
    "archive_system": "data-sd2e-community",
    "generated_by": [
        "106026ac-d0b3-5b01-8a84-64b010d0b58f"
    ],
    "child_of": [
        "10483e8d-6602-532a-8941-176ce20dd05a"
    ],
    "acted_on": [
        "105291c2-0404-5121-b658-7cd83f032bb8",
        "105f8f21-6dd4-51a0-b51a-8d2338d59bd6"
    ],
    "acted_using": [
        "10926b36-c9cd-5f0c-8b3c-f3d366dc34bf",
        "1092d775-0f7c-5b4d-970f-e739711d5f36"
    ],
    "task": null,
    "agent": null,
    "data": {
        "param1": "value1",
        "param2": 1,
        "param3": true,
        "param4": [
            1,
            2,
            3
        ],
        "param5": [
            "a",
            "b",
            "c",
            "d"
        ]
    },
    "session": "earnest-egret"
}
